{
  "schema": "autopilot.foreman-activity/1",
  "scope": {
    "project_key": "629fcdb8f8b4011a",
    "repo_identity": "git-common-dir:/home/cookys/projects/gate-sandbox4/.git",
    "root_run_id": "job-1791214261-8a0411cc"
  },
  "binding": "session",
  "stall_s": 600,
  "agents": [
    {
      "agent_id": "acf4a1a522ac176d1",
      "description": null,
      "label": null,
      "last_activity_at": "2026-10-05T15:36:57.697Z",
      "age_s": 11,
      "stale": false,
      "stamped": true,
      "ended_at": "2026-10-05T15:36:57.697Z",
      "source": "stamp",
      "session_id": "8756dd52-03e5-4a15-96c5-71ed90a78beb",
      "binding": "session"
    },
    {
      "agent_id": "a2050ae40e823a31c",
      "description": null,
      "label": null,
      "last_activity_at": "2026-10-05T15:31:29.485Z",
      "age_s": 340,
      "stale": false,
      "stamped": true,
      "ended_at": "2026-10-05T15:31:29.485Z",
      "source": "stamp",
      "session_id": "8756dd52-03e5-4a15-96c5-71ed90a78beb",
      "binding": "session"
    }
  ],
  "stage": null,
  "stage_source": null,
  "stage_at": null,
  "stage_age_s": null
}
