{
  "schema": "autopilot.foreman-activity/1",
  "scope": {
    "project_key": "51de403da82a23f0",
    "repo_identity": "git-common-dir:/home/cookys/projects/gate-sandbox/.git",
    "root_run_id": "job-1791516065-ff89e6a7"
  },
  "binding": "session",
  "stall_s": 600,
  "agents": [
    {
      "agent_id": "a44b8690286ef5054",
      "description": "L4 foreman: README line 2 + note",
      "label": "L4 foreman: README line 2 + note",
      "last_activity_at": "2026-10-09T03:21:43.526Z",
      "age_s": 8,
      "stale": false,
      "stamped": true,
      "ended_at": "2026-10-09T03:21:46.914Z",
      "source": "stamp",
      "session_id": "3028da81-bc08-4aa5-8ea9-8f6786b5c6ab",
      "binding": "session"
    },
    {
      "agent_id": "af584d0d149d4a4e9",
      "description": "Add l4 line and note",
      "label": "Add l4 line and note",
      "last_activity_at": "2026-10-09T03:21:32.259Z",
      "age_s": 19,
      "stale": false,
      "stamped": true,
      "ended_at": "2026-10-09T03:21:33.942Z",
      "source": "stamp",
      "session_id": "3028da81-bc08-4aa5-8ea9-8f6786b5c6ab",
      "binding": "session"
    },
    {
      "agent_id": "aab362d9d2773fbb1",
      "description": null,
      "label": "last tool: Bash",
      "last_activity_at": "2026-10-09T03:15:08.819Z",
      "age_s": 402,
      "stale": false,
      "stamped": true,
      "ended_at": "2026-10-09T03:15:14.482Z",
      "source": "stamp",
      "session_id": "3028da81-bc08-4aa5-8ea9-8f6786b5c6ab",
      "binding": "session"
    },
    {
      "agent_id": "a4c651d60c49bc68a",
      "description": null,
      "label": "last tool: Bash",
      "last_activity_at": "2026-10-09T03:15:01.879Z",
      "age_s": 409,
      "stale": false,
      "stamped": true,
      "ended_at": "2026-10-09T03:15:04.443Z",
      "source": "stamp",
      "session_id": "3028da81-bc08-4aa5-8ea9-8f6786b5c6ab",
      "binding": "session"
    },
    {
      "agent_id": "aab2e843d76483a0d",
      "description": null,
      "label": "last tool: Bash",
      "last_activity_at": "2026-10-09T03:14:55.103Z",
      "age_s": 416,
      "stale": false,
      "stamped": true,
      "ended_at": "2026-10-09T03:15:00.101Z",
      "source": "stamp",
      "session_id": "3028da81-bc08-4aa5-8ea9-8f6786b5c6ab",
      "binding": "session"
    },
    {
      "agent_id": "a35522ad6615bee1e",
      "description": "L4 foreman retry: README line",
      "label": "L4 foreman retry: README line",
      "last_activity_at": "2026-10-09T03:14:38.041Z",
      "age_s": 433,
      "stale": false,
      "stamped": true,
      "ended_at": "2026-10-09T03:14:41.383Z",
      "source": "stamp",
      "session_id": "3028da81-bc08-4aa5-8ea9-8f6786b5c6ab",
      "binding": "session"
    },
    {
      "agent_id": "a3fe32cd10cd934d3",
      "description": null,
      "label": "last tool: Bash",
      "last_activity_at": "2026-10-09T03:14:18.886Z",
      "age_s": 452,
      "stale": false,
      "stamped": true,
      "ended_at": "2026-10-09T03:14:20.251Z",
      "source": "stamp",
      "session_id": "3028da81-bc08-4aa5-8ea9-8f6786b5c6ab",
      "binding": "session"
    },
    {
      "agent_id": "ac409d8f4a3f60b4d",
      "description": null,
      "label": null,
      "last_activity_at": "2026-10-09T03:14:06.809Z",
      "age_s": 464,
      "stale": false,
      "stamped": true,
      "ended_at": "2026-10-09T03:14:06.809Z",
      "source": "stamp",
      "session_id": "3028da81-bc08-4aa5-8ea9-8f6786b5c6ab",
      "binding": "session"
    },
    {
      "agent_id": "ade5584433563b5f8",
      "description": null,
      "label": null,
      "last_activity_at": "2026-10-09T03:13:01.533Z",
      "age_s": 530,
      "stale": false,
      "stamped": true,
      "ended_at": "2026-10-09T03:13:08.604Z",
      "source": "stamp",
      "session_id": "3028da81-bc08-4aa5-8ea9-8f6786b5c6ab",
      "binding": "session"
    }
  ],
  "stage": null,
  "stage_source": null,
  "stage_at": null,
  "stage_age_s": null
}
